"usageclass","checkouttype","materialtype","checkoutyear","checkoutmonth","checkouts","title","creator","subjects","publisher","publicationyear"
"Physical","Horizon","VIDEODISC","2014","10","150","In a world-- [videorecording] / Stage 6 Films ; a 3311 production ; in association with More Films + Team G ; producers, Eddie Waisman, Mark Roberts, Lake Bell, Jett Steiger ; written & directed by Lake Bell.",,"Voice actors and actresses Drama, Vocal coaches Drama, Feature films, Comedy films, Fiction films, Video recordings for the hearing impaired","[Publisher not identified],","[2014?]"
"Physical","Horizon","BOOK","2014","10","150","The boys in the boat : nine Americans and their epic quest for gold at the 1936 Berlin Olympics / Daniel James Brown.","Brown, Daniel, 1951-","Rowing United States History, Rowers United States Biography, University of Washington Rowing History, Olympics","Viking,","[2013]"
"Physical","Horizon","VIDEODISC","2014","10","150","The spectacular now [videorecording] / A24 ; Twenty-One Laps Entertainment ; AL Productions ; produced by Tom McNulty, Shawn Levy, Michelle Krumm, Andrew Lauren ; screenplay by Scott Neustadter & Michael H. Weber ; directed by James Ponsoldt.",,"Teenagers Conduct of life Drama, Teenagers Sexual behavior Drama, Young adults Drama, Feature films, Fiction films, Comedy films, Coming of age films, Video recordings for the hearing impaired","Lionsgate,","[2014]"
"Physical","Horizon","VIDEODISC","2014","12","150","Bad words [videorecording] / Focus Features ; a Darko Entertainment/Aggregate Films/MXN production ; producers, Jason Bateman, Mason Novick, Sean McKittrick, Jeff Culotta ; written by Andrew Dodge ; directed by Jason Bateman.",,"Spelling bees Drama, Revenge Drama, Feature films, Comedy films, Fiction films, Video recordings for the hearing impaired","Focus Entertainment","2014."
"Physical","Horizon","VIDEODISC","2014","12","150","House of cards. The complete first season [videorecording] / MRC.",,"Political plays, Journalists Drama, Television series, Fiction television programs, Political television programs, Video recordings for the hearing impaired","Sony Pictures Home Entertainment,","[2013]"
"Physical","Horizon","VIDEODISC","2014","12","150","Pacific Rim [videorecording] / Warner Bros. Pictures ; Legendary Pictures ; story by Travis Beacham ; screenplay by Travis Beacham and Guillermo del Toro ; produced by Thomas Tull, Jon Jashini, Guillermo de Toro, Mary Parent ; directed by Guillermo del Toro.",,"Monsters Drama, Sea monsters Drama, Heroes Drama, Robots Drama, End of the world Drama, Feature films, Action and adventure films, Science fiction films, Thrillers Motion pictures, Fiction films, Video recordings for the hearing impaired","Warner Bros. Entertainment,","[2013]"
"Physical","Horizon","VIDEODISC","2014","12","150","Joe [videorecording] / Lionsgate ; Roadside Attractions ; in association with Worldview Entertainment and Dreambridge Films ; a Muskat Filmed Properties/Rough House Pictures production ; directed by David Gordon Green ; written by Gary Hawkins ; produced by David Gordon Green, Lisa Muskat, Christopher Woodrow, Derrick Tseng.",,"Ex convicts Drama, Dysfunctional families Drama, Abusive men Drama, Fathers and sons Drama, Feature films, Thrillers Motion pictures, Fiction films, Coming of age films, Video recordings for the hearing impaired","[Publisher not identified],","[2014]"
"Physical","Horizon","BOOK","2015","3","150","The boys in the boat : nine Americans and their epic quest for gold at the 1936 Berlin Olympics / Daniel James Brown.","Brown, Daniel, 1951-","Rowing United States History, Rowers United States Biography, University of Washington Rowing History, Olympics","Viking,","[2013]"
"Physical","Horizon","VIDEODISC","2015","3","150","Draft day [videorecording] / Summit Entertainment ; OddLot Entertainment ; The Montecito Picture Company ; produced by Ivan Reitman, Ali Bell, Joe Medjuck ; written by Rajiv Joseph & Scott Rothman ; directed by Ivan Reitman.",,"Cleveland Browns Football team 1999 Drama, National Football League Drama, Football draft Drama, Football teams Management Drama, Football players Drama, Rookie football players Drama, Cleveland Ohio Drama, Feature films, Fiction films, Sports films, Video recordings for the hearing impaired","Summit Entertainment,","[2014]"
"Digital","OverDrive","EBOOK","2015","4","150","The Cuckoo's Calling: Cormoran Strike Series, Book 1","Robert Galbraith","Fiction, Mystery","Hachette Digital, Inc.","2013"
"Physical","Horizon","VIDEODISC","2015","4","150","Kill the messenger [videorecording] / Focus Features ; a Bluegrass Films production ; produced by Scott Stuber, Naomi Despres, Jeremy Renner ; written by Peter Landesman ; directed by Michael Cuesta.",,"Drug traffic Drama, Journalists Drama, Feature films, Thrillers Motion pictures, Fiction films, Video recordings for the hearing impaired","[Publisher not identified],","[2015]"
"Physical","Horizon","VIDEODISC","2015","4","150","Ender's game [videorecording] / Summit Entertainment ; a Chartoff Productions, Taleswapper, Oddlot Entertainment, K/O Paper Products, Digital Domain production ; produced by Gigi Pritzker, Linda McDonough, Alex Kurtzman, Roberto Orci, Robert Chartoff, Lynn Hendee, Orson Scott Card, Ed Ulbrich ; screenplay by Gavin Hood ; directed by Gavin Hood.",,"Wiggin Ender Fictitious character Drama, Brothers and sisters Drama, Gifted children Drama, Military education Drama, War games Drama, Genetic engineering Drama, Action and adventure films, Science fiction films, Feature films, Fiction films, Video recordings for the hearing impaired, Video recordings for people with visual disabilities","Summit Entertainment,","[2014]."
"Digital","Zinio","MAGAZINE","2015","5","150","Cook's Illustrated",,,,
"Digital","OverDrive","EBOOK","2015","6","150","The Life-Changing Magic of Tidying Up: The Japanese Art of Decluttering and Organizing","Marie Kondo","Home Design & Décor, Nonfiction, Philosophy, Self-Improvement","Random House, Inc.","2014"
"Physical","Horizon","VIDEODISC","2015","6","150","The maze runner [videorecording] / Twentieth Century Fox ; a Gotham Group/Temple Hill production ; produced by Ellen Goldsmith-Vein, Wyck Godfrey, Marty Bowen, Lee Stollman ; directed by Wes Ball ; screenplay by Noah Oppenheim and Grant Pierce Myers and T.S. Nowlin.",,"Amnesia Drama, Cooperativeness Drama, Labyrinths Drama, Feature films, Fiction films, Action and adventure films, Science fiction films, Video recordings for the hearing impaired, Video recordings for people with visual disabilities","20th Century Fox Home Entertainment,","[2014]"
"Digital","OverDrive","EBOOK","2015","7","150","The Paying Guests","Sarah Waters","Fiction, Historical Fiction, Literature","Penguin Group (USA), Inc.","2014"
"Digital","OverDrive","EBOOK","2015","8","150","Cloud Atlas: A Novel","David Mitchell","Fantasy, Fiction, Historical Fiction, Literature","Random House, Inc.","2009"
"Physical","Horizon","VIDEODISC","2015","8","150","Game of thrones. The complete third season [videorecording] / HBO Entertainment.",,"Kings and rulers Drama, Nobility Drama, Imaginary wars and battles Drama, Action and adventure television programs, Fantasy television programs, Fiction television programs, Television series, Video recordings for the hearing impaired","Home Box Office, Inc.,","[2014]"
"Physical","Horizon","VIDEODISC","2015","8","150","Kill the messenger [videorecording] / Focus Features ; a Bluegrass Films production ; produced by Scott Stuber, Naomi Despres, Jeremy Renner ; written by Peter Landesman ; directed by Michael Cuesta.",,"Drug traffic Drama, Journalists Drama, Feature films, Thrillers Motion pictures, Fiction films, Video recordings for the hearing impaired","[Publisher not identified],","[2015]"
"Physical","Horizon","VIDEODISC","2015","9","150","Snowpiercer [videorecording] / Radius-TWC ; the Weinstein Company ; CJ Entertainment ; Moho Film ; Opus Pictures ; in association with Union Investment Partners ; producers, Jeong Tae-Sung, Steven Nam, Park Chan-Wook, Lee Tae Hun ; screen story by Bong Joon Ho ; screenplay by Bong Joon Ho and Kelly Masterson ; directed by Bong Joon Ho.",,"Railroad trains Drama, Social classes Drama, Disasters Drama, Feature films, Action and adventure films, Science fiction films, Fiction films, Video recordings for the hearing impaired","Anchor Bay Entertainment,","[2014]"
"Physical","Horizon","VIDEODISC","2015","10","150","Dear white people [videorecording] / Lionsgate ; Roadside Attractions ; Code Red ; in association with Homegrown Pictures ; a Duly Noted, Inc. production ; produced by Angel Lopez, Ann Le, Lena Waithe, Julia Lebedev, Effie Brown ; written, produced, and directed by Justin Simien.",,"African American students Drama, College students Drama, Fiction films, Comedy films, Feature films, Video recordings for the hearing impaired","[Publisher not identified],","[2015]"
"Physical","Horizon","BOOK","2015","12","150","The crossing : a novel / Michael Connelly.","Connelly, Michael, 1956-","Bosch Harry Fiction, Haller Mickey Fictitious character Fiction, Mystery fiction, Suspense fiction","Little, Brown and Company,","2015."
"Physical","Horizon","VIDEODISC","2015","12","150","Her [videorecording] / Warner Bros. Picture ; Annapurna Pictures ; produced by Megan Ellison , Spike Jonze, Vincent Landay ; written and directed by Spike Jonze.",,"Artificial intelligence Drama, Operating systems Computers Drama, Man woman relationships Drama, Authors Drama, Feature films, Fiction films, Science fiction films, Video recordings for the hearing impaired","Distributed by Warner Home Video","[2014]"
"Digital","OverDrive","EBOOK","2015","12","150","Go Set a Watchman: To Kill a Mockingbird Series, Book 2","Harper Lee","Fiction, Historical Fiction","HarperCollins Publishers Inc.","2015"
"Physical","Horizon","VIDEODISC","2016","1","150","Exodus [videorecording] : gods and kings / Twentieth Century Fox ; TSG Entertainment ; Chernin Entertainment ; Scott Free ; produced by Peter Chernin, Ridley Scott, Jenno Topping, Michael Schaefer, Mark Huffman ; written by Adam Cooper & Bill Collage and Jeffrey Caine and Steven Zaillian ; directed by Ridley Scott.",,"Moses Biblical leader Drama, Exodus The Drama, Bible films, Historical films, Fiction films, Feature films, Action and adventure films, Video recordings for the hearing impaired, Video recordings for people with visual disabilities","20th Century Fox Home Entertainment,","[2015]"
"Physical","Horizon","VIDEODISC","2016","2","150","A walk in the woods [videorecording] / Broad Green Pictures ; a Route One presentation ; in association with Union Investment Partners, Surefire Entertainment Capital ; a Wildwood Enterprises production ; screenplay by Rick Kerb and Bill Holderman ; produced by Robert Redford, Bill Holderman, Chip Diggins ; directed by Ken Kwapis.",,"Hiking Drama, Male friendship Drama, Appalachian Trail Drama, Feature films, Comedy films, Fiction films, Video recordings for the hearing impaired","Broad Green Pictures,","2015."
"Physical","Horizon","VIDEODISC","2016","4","150","A walk in the woods [videorecording] / Broad Green Pictures ; a Route One presentation ; in association with Union Investment Partners, Surefire Entertainment Capital ; a Wildwood Enterprises production ; screenplay by Rick Kerb and Bill Holderman ; produced by Robert Redford, Bill Holderman, Chip Diggins ; directed by Ken Kwapis.",,"Hiking Drama, Male friendship Drama, Appalachian Trail Drama, Feature films, Comedy films, Fiction films, Video recordings for the hearing impaired","Broad Green Pictures,","2015."
"Physical","Horizon","VIDEODISC","2016","4","150","The lady in the van [videorecording] / Sony Pictures Classics ; BBC Films ; TriStar Pictures ; produced by Kevin Loader, Nicholas Hytner, Damian Jones ; directed by Nicholas Hytner ; screenplay by Alan Bennett.",,"Bennett Alan 1934 Drama, Homeless women Drama, Interpersonal relations Drama, Feature films, Comedy films, Fiction films, Video recordings for the hearing impaired, Video recordings for people with visual disabilities","Sony Pictures Home Entertainment,","[2016]"
"Digital","Zinio","MAGAZINE","2016","5","150","O, The Oprah Magazine",,,,
"Physical","Horizon","VIDEODISC","2016","6","150","Secret in their eyes [videorecording] / Universal ; STX Entertainment ; IM Global ; in association with Route One/Union Investment Partners ; a Gran Via production ; produced by Mark Johnson, Matt Jackson ; screenplay by Billy Ray ; directed by Billy Ray.",,"Murder Investigation Drama, Daughters Death Drama, United States Federal Bureau of Investigation Drama, Feature films, Fiction films, Thrillers Motion pictures, Action and adventure films, Video recordings for the hearing impaired","Universal Studios Home Entertainment,","[2016]"
"Physical","Horizon","VIDEODISC","2016","8","150","Tomorrowland [videorecording] / Walt Disney Pictures ; an A113 production ; produced by Damon Lindelof, Brad Bird, Jeffrey Chernov ; screenplay by Damon Lindelof and Brad Bird ; story by Damon Lindelof & Brad Bird & Jeff Jensen ; directed by Brad Bird.",,"Outer space Exploration Drama, Feature films, Science fiction films, Fiction films, Video recordings for the hearing impaired, Video recordings for people with visual disabilities","Buena Vista Home Entertainment,","[2015]"
"Physical","Horizon","BOOK","2016","8","150","When breath becomes air / Paul Kalanithi ; foreword by Abraham Verghese.","Kalanithi, Paul.","Kalanithi Paul Health, Lungs Cancer Patients United States Biography, Neurosurgeons Biography, Husband and wife","Random House,","[2016]"
"Digital","OverDrive","EBOOK","2017","2","150","The Girl in the Spider's Web: A Lisbeth Salander Novel, Continuing Stieg Larsson's Millennium Series","David Lagercrantz","Fiction, Mystery, Suspense, Thriller","Random House, Inc.","2015"
"Physical","Horizon","VIDEODISC","2017","2","150","Game of thrones. The complete fifth season [videorecording] / HBO Entertainment ; producers, Chris Newman, Greg Spence, Bryan Cogman, Lisa McAtackney.",,"Kings and rulers Drama, Nobility Drama, Imaginary wars and battles Drama, Action and adventure television programs, Fantasy television programs, Fiction television programs, Television series, Video recordings for the hearing impaired","Home Box Office, Inc.,","[2016]"
"Physical","Horizon","VIDEODISC","2017","4","150","The edge of seventeen / STX Entertainment and Huayi Brothers Pictures ; a Gracie Films production ; produced by James L. Brooks, Richard Sakai, Julie Ansell ; written and directed by Kelly Fremon Craig.",,"High school students Drama, Best friends Drama, Brothers and sisters Drama, Dating Social customs Drama, Feature films, Coming of age films, Teen films, Comedy films, Fiction films, Video recordings for the hearing impaired, Video recordings for people with visual disabilities","Universal Pictures Home Entertainment,","[2017]"
"Digital","OverDrive","AUDIOBOOK","2017","5","150","All the Light We Cannot See: A Novel (unabridged) (Unabridged)","Anthony Doerr","Fiction, Historical Fiction","Simon & Schuster - All Library","2014"
"Digital","OverDrive","EBOOK","2017","5","150","A Man Called Ove: A Novel","Fredrik Backman","Fiction, Humor (Fiction), Literature","Simon & Schuster, Inc.","2014"
"Digital","OverDrive","EBOOK","2017","7","150","Commonwealth","Ann Patchett","Fiction, Literature","HarperCollins Publishers Inc.","2016"
"Physical","Horizon","BOOK","2017","7","150","Behold the dreamers : a novel / Imbolo Mbue.","Mbue, Imbolo.","Cameroonians United States Fiction, Immigrants United States Fiction, Upper class United States Fiction, Families Fiction, Family secrets Fiction, Global Financial Crisis 2008 2009 Fiction","Random House,","2016."
"Physical","Horizon","VIDEODISC","2017","8","150","I am not your negro / written by James Baldwin ; directed by Raoul Peck ; produced by Rémi Grellety, Raoul Peck, Hébert Peck ; a co-production of Velvet Film, Inc., Velvet Film S.A.S., Artemis Productions, Close Up Films, Arte France, RTS, RTBF.",,"United States Race relations, Civil rights movements United States History 20th century, Racism United States, African Americans Civil rights History 20th century, Nonfiction films, Documentary films, Historical films, Feature films, Film adaptations, Video recordings for the hearing impaired","Distributed by Magnolia Home Entertainment,","c2017."
"Physical","Horizon","VIDEODISC","2017","9","150","Gifted / Fox Searchlight Pictures ; TSG Entertainment ; a FilmNation Entertainment/Grade A Entertainment production ; produced by Karen Lunder, Andy Cohen ; written by Tom Flynn ; directed by Marc Webb.",,"Gifted children Drama, Uncles Drama, Grandmothers Drama, Custody of children Drama, Feature films, Fiction films, Video recordings for the hearing impaired, Video recordings for people with visual disabilities","20th Century Fox Home Entertainment,","[2017]"
"Physical","Horizon","VIDEODISC","2017","10","150","Finding Dory [videorecording] / Walt Disney Pictures ; Pixar Animation Studios ; directed by Andrew Stanton ; co-directed by Angus MacLane ; produced by Lindsey Collins ; original story by Andrew Stanton ; screenplay by Andrew Stanton, Victoria Strouse.",,"Anemonefishes Juvenile drama, Missing children Juvenile drama, Parent and child Juvenile drama, Fishes Juvenile drama, Memory Juvenile drama, Quests Expeditions Juvenile drama, Animated films, Childrens films, Fiction films, Feature films, Video recordings for the hearing impaired, Video recordings for people with visual disabilities","Distributed by Buena Vista Home Entertainment,","2016."
"Physical","Horizon","VIDEODISC","2017","10","150","Hell or high water [videorecording] / Lionsgate ; CBS Films ; a Sidney Kimmel Entertainment, Film 44, LBI Entertainment, OddLot Entertainment production ; directed by David Mackenzie ; written by Taylor Sheridan ; produced by Sidney Kimmel, Peter Berg, Carla Hacken, Julie Yorn",,"Farm foreclosures Texas Drama, Divorced men Drama, Brothers Drama, Feature films, Thrillers Motion pictures, Action and adventure films, Video recordings for the hearing impaired, Video recordings for people with visual disabilities","Lions Gate Home Entertainment,","[2016]"
"Digital","OverDrive","EBOOK","2017","12","150","Into the Water: A Novel","Paula Hawkins","Fiction, Literature, Suspense, Thriller","Penguin Group (USA), Inc.","2017"
"Digital","OverDrive","AUDIOBOOK","2017","12","150","What Happened (Unabridged)","Hillary Rodham Clinton","Biography & Autobiography, Nonfiction, Politics","Simon & Schuster - All Library","2017"
"Digital","OverDrive","AUDIOBOOK","2018","3","150","Ready Player One (Unabridged)","Ernest Cline","Fiction, Science Fiction, Thriller","Books on Tape","2011"
"Digital","OverDrive","EBOOK","2018","5","150","Into the Water: A Novel","Paula Hawkins","Fiction, Literature, Suspense, Thriller","Penguin Group (USA), Inc.","2017"
"Physical","Horizon","VIDEODISC","2018","5","150","The mountain between us / 20th Century Fox ; CE ; Fox 2000 Pictures ; directed by Hany Abu-Assad ; screenplay by Chris Weitz and J. Mills Goodloe ; produced by Peter Chernin, Jenno Topping, David Ready.",,"Airplane crash survival Drama, Man woman relationships Drama, Wilderness areas Drama, Mountains Drama, Action and adventure films, Feature films, Fiction films, Video recordings for the hearing impaired, Video recordings for people with visual disabilities","20th Century Fox Home Entertainment,","[2017]"
"Digital","OverDrive","AUDIOBOOK","2018","5","150","A Wrinkle In Time: Time Quartet, Book 1 (unabridged) (Unabridged)","Madeleine L'engle","Juvenile Fiction, Science Fiction","Books on Tape","2012"
"Physical","Horizon","VIDEODISC","2018","6","150","Wonder Woman / directed by Patty Jenkins ; screenplay by Allan Heinberg ; story by Zack Snyder & Allan Heinberg and Jason Fuchs ; produced by Charles Roven, Deborah Snyder, Zack Snyder, Richard Suckle ; a Warner Bros. Pictures presentation ; in association with RatPac-Dune Entertainment, Tencent Pictures and Wanda Pictures ; an Atlas Entertainment/Cruel and Unusual production.",,"Wonder Woman Fictitious character Drama, Women superheroes Drama, Superheroes Drama, Amazons Drama, World War 1914 1918 Drama, Feature films, Fiction films, Action and adventure films, Fantasy films, Science fiction films, War films, Superhero films, Video recordings for people with visual disabilities, Video recordings for the hearing impaired","Warner Bros. Home Entertainment,","[2017]"
"Physical","Horizon","VIDEODISC","2018","7","150","The commuter / Lionsgate ; Studiocanal ; The Picture Company ; in association with Ombra Films ; produced by Andrew Rona, Alex Heineman ; story by Byron Willinger & Philip de Blasi ; screenplay by Byron Willinger & Philip De Blasi and Ryan Engle ; directed by Jaume Collet-Serra.",,"Commuters Drama, Conspiracies Drama, Crime Drama, Action and adventure films, Detective and mystery films, Thrillers Motion pictures, Feature films, Fiction films, Video recordings for people with visual disabilities, Video recordings for the hearing impaired","Lionsgate,","[2018]"
"Physical","Horizon","VIDEODISC","2018","7","150","American made / a Universal Pictures and Cross Creek Pictures presentation ; in association with Imagine Entertainment ; in association with Vendian Entertainment, Quadrant Pictures and Hercules Film Fund ; directed by Doug Liman ; written by Gary Spinelli ; produced by Brian Grazer, Brian Oliver, Doug Davison, Kim Roth, Ray Angelic, Tyler Thompson.",,"Seal Barry 1939 1986 Drama, United States Central Intelligence Agency Drama, Air pilots Drama, Drug couriers Drama, Crime Drama, Feature films, Fiction films, Action and adventure films, Biographical films, Historical films, Video recordings for the hearing impaired, Video recordings for people with visual disabilities","Universal Pictures Home Entertainment,","[2018]"
"Physical","Horizon","VIDEODISC","2018","8","150","Love, Simon / Twentieth Century Fox ; Temple Hill ; Fox 2000 Pictures ; produced by Wyck Godfrey, Marty Bowen, Pouya Shahbazian, Isaac Klausner ; screenplay by Elizabeth Berger & Isaac Aptaker ; directed by Greg Berlanti.",,"Gay teenagers Drama, Friendship in adolescence Drama, Secrecy Drama, Coming out Sexual orientation Drama, Pen pals Drama, High schools Drama, High school students Drama, Extortion Drama, Feature films, Coming of age films, Fiction films, Video recordings for the hearing impaired, Video recordings for people with visual disabilities","Twentieth Century Fox Home Entertainment,","[2018]"
"Physical","Horizon","ER","2018","8","150","FlexTech--Tablets.",,"iPad Computer, Tablet computers","Apple Inc.,","[2013?]-"
"Digital","OverDrive","AUDIOBOOK","2018","9","150","All the Light We Cannot See: A Novel (unabridged) (Unabridged)","Anthony Doerr","Fiction, Historical Fiction","Simon & Schuster - All Library","2014"
"Physical","Horizon","BOOK","2018","10","150","Dog Man. A tale of two kitties / written and illustrated by Dav Pilkey, as George Beard and Harold Hutchins ; with color by Jose Garibaldi.","Pilkey, Dav, 1966-","Dog Man Fictitious character Comic books strips etc, Dogs Comic books strips etc, Cats Comic books strips etc, Police Comic books strips etc, Cartoons and comics, Graphic novels, Humorous comics","Graphix, an imprint of Scholastic,","2017."
"Digital","OverDrive","EBOOK","2018","11","150","The Woman in the Window: A Novel","A. J. Finn","Fiction, Suspense, Thriller","HarperCollins Publishers Inc.","2018"
"Digital","OverDrive","EBOOK","2018","12","150","Into the Water: A Novel","Paula Hawkins","Fiction, Literature, Suspense, Thriller","Penguin Group (USA), Inc.","2017"
"Digital","OverDrive","AUDIOBOOK","2018","12","150","Harry Potter and the Sorcerer's Stone: Harry Potter Series, Book 1 (unabridged) (Unabridged)","J. K. Rowling","Fantasy, Young Adult Fiction","Pottermore","2012"
"Physical","Horizon","VIDEODISC","2019","1","150","A simple favor / Lionsgate ; Feigco Entertainment ; in association with Hercules Bron Creative Partnership ; directed by Paul Fieg ; screenplay by Jessica Sharzer ; produced by Paul Fieg, Jessie Henderson.",,"Single mothers Fiction, Bloggers Fiction, Missing persons Drama, Video blogs Drama, Female friendship Fiction, Deception Fiction, Feature films, Thrillers Motion pictures, Detective and mystery films, Fiction films, Video recordings for the hearing impaired, Video recordings for people with visual disabilities","Lions Gate Entertainment,","[2018]"
"Physical","Horizon","BOOK","2019","2","150","The hate u give / Angie Thomas.","Thomas, Angie","Witnesses Juvenile fiction, African Americans Juvenile fiction, Race relations Juvenile fiction, Police shootings Juvenile fiction, Police community relations Juvenile fiction, Young adult fiction","Balzer + Bray, an imprint of HarperCollins Publishers,","[2017]"
"Digital","OverDrive","EBOOK","2019","3","150","Past Tense: A Jack Reacher Novel","Lee Child","Fiction, Mystery, Suspense, Thriller","Random House, Inc.","2018"
"Physical","Horizon","BOOK","2019","3","150","Kingdom of the blind / Louise Penny.","Penny, Louise","Gamache Armand Fictitious character Fiction, Executors and administrators Fiction, Wills Fiction, Qu‚bec Province Fiction, Detective and mystery fiction","Minotaur Books,","2018."
"Physical","Horizon","VIDEODISC","2019","4","150","RBG / Magnolia Pictures, Participant Media & CNN Films present ; a Storyville Films production ; directed & produced by Julie Cohen, Betsy West ; executive producers, Amy Entelis, Courtney Sexton.",,"Ginsburg Ruth Bader, United States Supreme Court Officials and employees Biography, Women judges United States Biography, Biographical films, Feature films, Nonfiction films, Documentary films, Video recordings for the hearing impaired","Distributed by Magnolia Home Entertainment,","[2018]"
