"usageclass","checkouttype","materialtype","checkoutyear","checkoutmonth","checkouts","title","creator","subjects","publisher","publicationyear"
"Physical","Horizon","VIDEODISC","2016","10","150","Anomalisa [videorecording] / Paramount ; a Starburns Industries production ; a Snoot Entertainment production ; produced by Rosa Tran, Duke Johnson, Charlie Kaufman, Dino Stamatopoulos ; directed by Charlie Kaufman & Duke Johnson ; written by Charlie Kaufman.",,"Married men Drama, Man woman relationships Drama, Feature films, Puppet films, Fiction films, Video recordings for the hearing impaired, Video recordings for people with visual disabilities","Paramount,","[2016]"
"Physical","Horizon","VIDEODISC","2016","12","150","The man from U.N.C.L.E. [videorecording] / Warner Bros. Pictures ; in association with Ratpac-Dune Entertainment ; a Davis Entertainment production ; screenplay by Guy Ritchie & Lionel Wigram ; story by Guy Ritchie ... [and others] ; produced by John Davis, Steve Clark-Hall, Lionel Wigram, Guy Ritchie ; directed by Guy Ritchie.",,"United States Central Intelligence Agency Drama, Soviet Union Komitet gosudarstvennoi bezopasnosti Drama, Spies Drama, Feature films, Spy films, Action and adventure films, Fiction films, Video recordings for the hearing impaired, Video recordings for people with visual disabilities","Warner Home Video,","[2015]"
"Physical","Horizon","BOOK","2005","11","150","Bob books first! / text, Bobby Lynn Maslen ; pictures, John R. Maslen.","Maslen, Bobby Lynn","Readers Primary Juvenile fiction, Reading Primary Juvenile fiction","Scholastic Inc.,","[2000], c1976."
"Physical","Horizon","BOOK","2006","3","150","Bob books first! / text, Bobby Lynn Maslen ; pictures, John R. Maslen.","Maslen, Bobby Lynn","Readers Primary Juvenile fiction, Reading Primary Juvenile fiction","Scholastic Inc.,","[2000], c1976."
"Physical","Horizon","BOOK","2006","4","150","Bob books first! / text, Bobby Lynn Maslen ; pictures, John R. Maslen.","Maslen, Bobby Lynn","Readers Primary Juvenile fiction, Reading Primary Juvenile fiction","Scholastic Inc.,","[2000], c1976."
"Physical","Horizon","BOOK","2006","4","150","A million little pieces / James Frey.","Frey, James, 1969-","Frey James 1969, Drug addicts Rehabilitation Minnesota, Drug addicts Minnesota Biography","Anchor Books,","2004."
"Physical","Horizon","VIDEODISC","2006","5","150","The hitchhiker's guide to the galaxy [videorecording] / a Barber/Birnbaum production, a Hammer and Tongs production, an Everyman Pictures ; producers, Gary Barber ... [and others] ; screenplay by Douglas Adams and Karey Kirkpatrick ; directed by Garth Jennings.",,"Prefect Ford Fictitious character Drama, Dent Arthur Fictitious character Drama, End of the world Drama, Feature films, Science fiction films, Comedy films, Fiction films, Video recordings for the hearing impaired","Touchstone Home Entertainment : Distributed by Buena Vista Home Entertainment,","[2005]"
"Physical","Horizon","VIDEODISC","2006","6","150","House of sand and fog",,"Video recordings for the hearing impaired, Suspense films, Feature films, Dwellings Drama, Retired military personnel Iran Drama",,
"Physical","Horizon","VIDEODISC","2006","6","150","House of Flying Daggers [videorecording] / Elite Group (2003) Enterprises, Inc. presents an Ekdo Films, Zhang Yimou Studio production in collaboration with Beijing New Picture Film Co., Ltd. ; produced by Bill Kong, Zhang Yimou ; screenplay by Li Feng, Zhang Yimou, Wang Bin ; story, Zhang Yimou, Li Feng, Wang Bin ; directed by Zhang Yimou.",,"Secret societies China Drama, Police China Drama, Man woman relationships China Drama, Feature films","Columbia TriStar Home Entertainment : Distributed by Sony Pictures Home Entertainment,","[2005]"
"Physical","Horizon","BOOK","2006","7","150","Uncataloged Folder or Bag--GWD",,,,
"Physical","Horizon","VIDEODISC","2006","8","150","National treasure [videorecording] / Walt Disney Pictures ; Jerry Bruckheimer Films ; Junction Entertainment ; Saturn Films ; produced by Jerry Bruckheimer, Jon Turteltaub ; screenplay, Jim Kouf and Cormac Wibberley & Marianne Wibberley ; story, Jim Kouf, Oren Aviv & Charles Segars ; directed by Jon Turteltaub.",,"Cultural property Drama, United States Declaration of Independence Drama, Feature films, Video recordings for the hearing impaired","Walt Disney Home Entertainment ; Distributed by Buena Vista Home Entertainment,","[2005]"
"Physical","Horizon","VIDEODISC","2006","8","150","Nanny McPhee [videorecording] / Universal Pictures and Studio Canal present in association with Metro-Goldwyn-Mayer Pictures, a Working Title production in association with Three Strange Angels ; produced by Tim Bevan, Lindsay Doran, Eric Fellner, Debra Hayward ; screenplay by Emma Thompson ; directed by Kirk Jones.",,"Nannies England Drama, Widowers England Drama, Children and adults England Drama, Feature films, Comedy films, Fantasy films, Childrens films, Video recordings for the hearing impaired","Universal Pictures,","[2006]"
"Physical","Horizon","VIDEODISC","2006","8","150","The aviator [videorecording] / Warner Bros. ; Miramax Films ; Initial Entertainment Group ; Forward Pass ; Appian Way ; Cappa Productions ; IMF Internationale Medien und Film GmbH & Co. 3. Produktions KG ; produced by Sandy Climan, Charles Evans, Jr., Graham King, Michael Mann ; written by John Logan ; directed by Martin Scorsese.",,"Hughes Howard 1905 1976 Drama, Air pilots Drama, Man woman relationships Drama, Feature films, Biographical films, Video recordings for the hearing impaired","Warner Home Video,","[2005]."
"Physical","Horizon","VIDEODISC","2006","9","150","Match point [videorecording] / British Broadcasting Corporation ; Magic Hour Media ; Thema Production ; Invicta Capital Ltd. ; BBC Films ; produced by Letty Aronson, Lucy Darwin, Gareth Wiley ; written by Woody Allen ; directed by Woody Allen.",,"Triangles Interpersonal relations Drama, Tennis players Drama, Brothers and sisters Drama, Feature films, Thrillers Motion pictures, Fiction films, Video recordings for the hearing impaired","DreamWorks Pictures : Distributed by Universal Studios Home Entertainment,","[2006]"
"Physical","Horizon","VIDEODISC","2006","9","150","interpreter",,"Video recordings for the hearing impaired, Feature films, Attempted assassination Drama, United Nations Headquarters Drama, Translators Drama",,
"Physical","Horizon","VIDEODISC","2006","9","150","Junebug [videorecording] / a Sony Pictures Classics release, an Epoch Films production ; producers, Mindy Goldberg, Mike S. Ryan ; written by Angus MacLachlan ; directed by Phil Morrison.",,"Art dealers Drama, Families North Carolina Drama, Feature films, Video recordings for the hearing impaired","Sony Pictures Home Entertainment,","[2006]"
"Physical","Horizon","VIDEODISC","2006","9","150","The notebook [videorecording] / Avery Pix ; Gran Via ; New Line Cinema ; produced by Lynn Harris, Mark Johnson ; screenplay, Jeremy Leven ; directed by Nick Cassavetes.",,"First loves Drama, Social classes Drama, Young adults Conduct of life Drama, Feature films, Video recordings for the hearing impaired","New Line Home Entertainment ; Distributed by Warner Home Video,","[2005]."
"Physical","Horizon","VIDEODISC","2006","9","150","Meet the Fockers",,"Video recordings for the hearing impaired, Comedy films, Feature films, Parents in law Drama",,
"Physical","Horizon","VIDEODISC","2006","10","150","Monty Pythons flying circus",,"Video recordings for the hearing impaired, Television comedies Great Britain",,
"Physical","Horizon","VIDEODISC","2006","12","150","Good night, and good luck [videorecording] / Warner Independent Pictures ; 2929 Productions ; Participant Productions ; Davis-Films ; Redbus Pictures ; Tohokashinsha Film Company ; Section Eight Ltd. ; Metropolitan ; produced by Grant Heslov ; screenplay by George Clooney & Grant Heslov ; directed by George Clooney.",,"Murrow Edward R Drama, McCarthy Joseph 1908 1957 Drama, United States History 20th century Drama, CBS News Drama, Television news anchors Drama, Feature films, Historical films, Video recordings for the hearing impaired","Warner Home Video,","[2006]"
"Physical","Horizon","VIDEODISC","2007","2","150","Flightplan [videorecording] / Touchstone Pictures and Imagine Entertainment present a Brian Grazer production ; produced by Brian Grazer ; written by Peter A. Dowling and Billy Ray ; directed by Robert Schwentke.",,"Mothers of kidnapped children Drama, Flight crews Drama, Air pilots Drama, Flight attendants Drama, Feature films, Thrillers Motion pictures, Video recordings for the hearing impaired","Touchstone Home Entertainment : Distributed by Buena Vista Home Entertainment,","[2006]"
"Physical","Horizon","VIDEODISC","2007","3","150","Over the hedge [videorecording] / DreamWorks Animation ; DreamWorks SKG ; produced by Bonnie Arnold ; screenplay by Len Blum ... [and others] ; directed by Tim Johnson, Karey Kirkpatrick.",,"Procyon Juvenile drama, Raccoon Juvenile drama, Forest animals Juvenile drama, Suburbs Juvenile drama, Feature films, Animated films, Childrens films, Comedy films, Action and adventure films, Fantasy films, Video recordings for the hearing impaired","DreamWorks Home Entertainment,","c2006."
"Physical","Horizon","VIDEODISC","2007","5","150","Superman returns",,"Fantasy films, Man woman relationships Drama, Video recordings for the hearing impaired, Superman Fictitious character Drama, Enemies Persons Drama, Feature films, Superman films, Lane Lois Fictitious character Drama",,
"Physical","Horizon","VIDEODISC","2007","6","150","Capote",,"Video recordings for the hearing impaired, Feature films, Smith Perry Edward 1928 1965 Drama, Murderers Interviews Drama, Capote Truman 1924 1984 Drama",,
"Physical","Horizon","VIDEODISC","2007","8","150","Clerks II [videorecording] / View Askew Productions ; Weinstein Company ; produced by Scott Mosier, Kevin Smith ; written by Kevin Smith ; directed by Kevin Smith.",,"Clerks Drama, Restaurants Employees Drama, Fast food restaurants Drama, Feature films, Comedy films, Video recordings for the hearing impaired","The Weinstein Co.,","c2006."
"Physical","Horizon","VIDEODISC","2007","8","150","Lady in the water",,"Fantasy films, Video recordings for the hearing impaired, Feature films, Characters and characteristics in literature Drama, Thrillers Motion pictures television etc, Maintenance Drama, Monsters in literature Drama",,
"Physical","Horizon","VIDEODISC","2007","10","150","Norbit",,"Comedy films, Triangles Interpersonal relations Drama, Video recordings for the hearing impaired, Jealousy Drama, Betrothal Drama, Feature films, Overweight women Drama",,
"Physical","Horizon","VIDEODISC","2007","10","150","The guardian [videorecording] / Beacon Pictures ; Contrafilm ; A School Productions ; Firm Films ; Touchstone Pictures ; produced by Beau Flynn, Tripp Vinson ; written by Ron L. Brinkerhoff ; directed by Andrew Davis.",,"United States Coast Guard Drama, Rescue work Drama, Survival swimming Drama, Lifesaving Drama, Feature films, Thrillers Motion pictures, Fiction films, Video recordings for the hearing impaired","Touchstone Home Entertainment : Distributed by Buena Vista Home Entertainment,","[2007]"
"Physical","Horizon","VIDEODISC","2007","11","150","Snakes on a plane [videorecording] / Hannah Rachel Production Services Ltd. ; Mutual Film Corporation ; New Line Cinema ; Patchwork Productions ; produced by Craig Berenson, Don Granger, Gary Levinsohn ; story by David Dalessandro and John Heffernan ; screenplay by John Heffernan and Sebastian Gutierrez ; directed by David R. Ellis.",,"Poisonous snakes Drama, Boidae Drama, Airplanes Drama, Witnesses Protection Drama, Assassins Drama, Feature films, Thrillers Motion pictures","New Line Home Entertainment : Warner Home Video [distributor],","[2007]"
"Physical","Horizon","VIDEODISC","2007","11","150","Blood diamond [videorecording] / Warner Bros. Pictures ; Bedford Falls Productions ; Initial Entertainment Group ; Spring Creek Productions ; Virtual Studios ; produced by Gilian Gorfil, Marshall Herskovitz, Graham King, Darrell Roodt, Paul Weinstein, Edward Zwick ; story by Charles Leavitt and C. Gaby Mitchell ; screenplay by Charles Leavitt ; directed by Edward Zwick.",,"Smugglers Sierra Leone Drama, Sierra Leone History Civil War 1991 2002 Drama, Diamonds Sierra Leone Drama, Feature films, Video recordings for the hearing impaired, Thrillers Motion pictures, Action and adventure films, War films","Warner Home Video,","[2007]"
"Physical","Horizon","VIDEODISC","2007","11","150","My super ex girlfriend",,"Science fiction films, Fantasy films, Heroes Drama, Video recordings for the hearing impaired, Separation Psychology Drama, Dating Social customs Drama, Feature films, Romantic comedy films, Superhero films",,
"Physical","Horizon","VIDEODISC","2007","11","150","Good night, and good luck [videorecording] / Warner Independent Pictures ; 2929 Productions ; Participant Productions ; Davis-Films ; Redbus Pictures ; Tohokashinsha Film Company ; Section Eight Ltd. ; Metropolitan ; produced by Grant Heslov ; screenplay by George Clooney & Grant Heslov ; directed by George Clooney.",,"Murrow Edward R Drama, McCarthy Joseph 1908 1957 Drama, United States History 20th century Drama, CBS News Drama, Television news anchors Drama, Feature films, Historical films, Video recordings for the hearing impaired","Warner Home Video,","[2006]"
"Physical","Horizon","BOOK","2007","12","150","Harry Potter and the deathly hallows / by J.K. Rowling ; illustrations by Mary GrandPré.","Rowling, J. K.","Potter Harry Fictitious character Juvenile fiction, Wizards Juvenile fiction, England Juvenile fiction, Hogwarts School of Witchcraft and Wizardry Imaginary organization Juvenile fiction","Arthur A. Levine Books,","2007."
"Physical","Horizon","VIDEODISC","2008","1","150","Blood diamond [videorecording] / Warner Bros. Pictures ; Bedford Falls Productions ; Initial Entertainment Group ; Spring Creek Productions ; Virtual Studios ; produced by Gilian Gorfil, Marshall Herskovitz, Graham King, Darrell Roodt, Paul Weinstein, Edward Zwick ; story by Charles Leavitt and C. Gaby Mitchell ; screenplay by Charles Leavitt ; directed by Edward Zwick.",,"Smugglers Sierra Leone Drama, Sierra Leone History Civil War 1991 2002 Drama, Diamonds Sierra Leone Drama, Feature films, Video recordings for the hearing impaired, Thrillers Motion pictures, Action and adventure films, War films","Warner Home Video,","[2007]"
"Physical","Horizon","VIDEODISC","2008","1","150","Proof",,"Fathers and daughters Drama, Mental illness Drama, Video recordings for the hearing impaired, Grief Drama, Feature films, Mathematicians Family relationships Drama",,
"Physical","Horizon","VIDEODISC","2008","1","150","Happy feet [videorecording] / Kingdom Feature Productions ; Animal Logic ; Kennedy Miller Productions ; Village Roadshow Pictures ; produced by Bill Miller, George Miller, Doug Mitchell ; written by Warren Coleman, John Collee, George Miller, Judy Morris ; directed by George Miller.",,"Emperor penguin Juvenile drama, Tap dancing Juvenile drama, Fishing Catch effort Antarctic regions Juvenile drama, Friendship Antarctic regions Juvenile drama, Antarctica Juvenile drama, Feature films, Animated films, Childrens films, Video recordings for the hearing impaired","Warner Home Video,","2007."
"Physical","Horizon","VIDEODISC","2008","2","150","The departed [videorecording] / Warner Bros. Pictures ; Vertigo Entertainment ; Initial Entertainment Group ; Plan B Entertainment ; Media Asia Films ; produced by Brad Grey, Graham King, Brad Pitt, Martin Scorsese ; screenplay by William Monahan ; directed by Martin Scorsese.",,"Organized crime Massachusetts Boston Drama, Organized crime investigation Massachusetts Boston Drama, Police Massachusetts Boston Drama, Undercover operations Massachusetts Boston Drama, Infiltration Military science Drama, Moles Spies Drama, South Boston Boston Mass Drama, Feature films, Thrillers Motion pictures, Fiction films, Gangster films, Video recordings for the hearing impaired","Warner Home Video,","[2007]"
"Physical","Horizon","VIDEODISC","2008","3","150","Evan almighty [videorecording] / Universal Pictures ; Spyglass Entertainment ; Shady Acres Entertainment ; Original Film ; Relativity Media ; produced by Gary Barber, Roger Birnbaum, Michael Bostick, Steve Carell, Neal H. Moritz, Tom Shadyac ; story by Steve Oedekerk and Joel Cohen & Alec Sokolow ; screenplay by Steve Oedekerk ; directed by Tom Shadyac.",,"Legislators Drama, Presence of God Drama, Trust in God Drama, Humanity Drama, Deluge Drama, Feature films, Fantasy films, Video recordings for the hearing impaired, Comedy films","Universal Studios Home Entertainment,","c2007."
"Physical","Horizon","VIDEODISC","2008","4","150","Children of men [videorecording] / Universal Pictures ; Strike Entertainment ; Hit & Run Productions ; Quietus Productions, Ltd. ; produced by Marc Abraham, Eric Newman, Hilary Shor, Iain Smith, Tony Smith ; screenplay by Alfonso Cuarón & Timothy J. Sexton and David Arata and Mark Fergus & Hawk Ostby ; directed by Alfonso Cuarón.",,"Fertility Human Drama, Extinction Biology Drama, Human rights workers Drama, Pregnant women Drama, Dystopias Drama, London England Drama, Feature films, Science fiction films, Action and adventure films, Video recordings for the hearing impaired, Thrillers Motion pictures","Universal Pictures,","[2007]"
"Physical","Horizon","BOOK","2008","4","150","SuperHero ABC / by Bob McLeod.","McLeod, Bob","Heroes Juvenile fiction, Alphabet Fiction","HarperCollins,","2006."
"Physical","Horizon","BOOK","2008","4","150","Uncataloged Folder or Bag--BAL",,,,
"Physical","Horizon","VIDEODISC","2008","4","150","The fountain [videorecording] / Warner Bros. Pictures ; Regency Enterprises ; Epsilon Motion Pictures ; New Regency Pictures ; Protozoa Pictures ; produced by Arnon Milchan, Iain Smith, Eric Watson ; story by Darren Aronofsky & Ari Handel ; screenplay by Darren Aronofsky ; directed by Darren Aronofsky.",,"Time travel Drama, Death Drama, Love Drama, Man woman relationships Drama, Explorers Drama, Space travelers Drama, Medical films Motion pictures, Feature films, Fantasy films, Science fiction films, Video recordings for the hearing impaired, Action and adventure films","Warner Home Video,","[2007]"
"Physical","Horizon","VIDEODISC","2008","5","150","Man of the year [videorecording] / Universal Pictures ; Morgan Creek Productions ; produced by Barry Levinson, James G. Robinson ; written by Barry Levinson ; directed by Barry Levinson.",,"Presidents Election Drama, Comedians Drama, Voting machines Drama, Computer system failures Drama, Fans Persons Drama, Feature films, Romantic comedy films, Thrillers Motion pictures, Fiction films, Video recordings for the hearing impaired","Universal Pictures,","[2007]"
"Physical","Horizon","VIDEODISC","2008","5","150","Good luck Chuck [videorecording] / Lionsgate ; K.E.I. ; produced by Mike Karz, Barry Karz and Brian Volk-Weiss ; screenplay by Josh Stolberg ; directed by Mark Helfrich.",,"Charms Drama, Blessing and cursing Drama, Dentists Drama, Man woman relationships Drama, Penguins Drama, Feature films, Video recordings for the hearing impaired, Comedy films","Lionsgate,","[2008]"
"Physical","Horizon","VIDEODISC","2008","6","150","El laberinto del fauno [videorecording] = Pan's labyrinth / Picturehouse and Telecinco present a production of Estudios Picasso ; Tequilla Gang ; Esperanto Filmoj in association with Caféx, Inc. ; produced by Alfonso Cuarón, Bertha Navarro, Guillermo del Toro, Frida Torresblanco ; screenplay by Guillermo del Toro ; directed by Guillermo del Toro.",,"Labyrinths Drama, Military bases Drama, Imagination in children Drama, Cruelty Drama, Mothers and daughters Drama, Good and evil Drama, Feature films, Fantasy films, Video recordings for the hearing impaired, Thrillers Motion pictures","New Line Home Entertainment : Distributed by Warner Home Video,","[2007]"
"Physical","Horizon","VIDEODISC","2008","7","150","Love in the time of cholera [videorecording] / New Line Cinema ; Stone Village Pictures in association with Grosvenor Park Media ; produced by Scott Steindorff ; screenplay by Ronald Harwood ; directed by Mike Newell.",,"First loves Drama, Physician and patient Drama, Man woman relationships Drama, Colombia Drama, Feature films, Melodramas Motion pictures, Video recordings for the hearing impaired","New Line Home Entertainment : Distributed by Warner Home Video,","[2008]"
"Physical","Horizon","VIDEODISC","2008","7","150","Casino Royale [videorecording] / Metro-Goldwyn-Mayer ; Columbia Pictures ; Albert R. Broccoli's Eon Productions Limited ; Danjaq LLC. ; Babelsberg Film GmbH ; Stillking Films ; United Artists ; produced by Barbara Broccoli, Michael G. Wilson ; screenplay by Neal Purvis & Robert Wade and Paul Haggis ; directed by Martin Campbell.",,"Bond James Fictitious character Drama, Great Britain MI6 Drama, Poker Tournaments Drama, Terrorists Drama, Criminal behavior Drama, Man woman relationships Drama, Feature films, Action and adventure films, Thrillers Motion pictures, Fiction films, Video recordings for the hearing impaired","Sony Pictures Home Entertainment,","[2007]"
"Physical","Horizon","VIDEODISC","2008","7","150","Match point [videorecording] / British Broadcasting Corporation ; Magic Hour Media ; Thema Production ; Invicta Capital Ltd. ; BBC Films ; produced by Letty Aronson, Lucy Darwin, Gareth Wiley ; written by Woody Allen ; directed by Woody Allen.",,"Triangles Interpersonal relations Drama, Tennis players Drama, Brothers and sisters Drama, Feature films, Thrillers Motion pictures, Fiction films, Video recordings for the hearing impaired","DreamWorks Pictures : Distributed by Universal Studios Home Entertainment,","[2006]"
"Physical","Horizon","VIDEODISC","2008","8","150","I now pronounce you Chuck Larry",,"Comedy films, Video recordings for the hearing impaired, Fire fighters Drama, Feature films, Gay couples Drama",,
"Physical","Horizon","VIDEODISC","2008","10","150","Penelope [videorecording] / Summit Entertainment ; Stone Village Pictures ; Type A Films ; a Tatira Active production in association with Grosvenor Park Media ; produced by Jennifer Simpson, Scott Steindorff, Reese Witherspoon ; written by Leslie Caveny ; directed by Mark Palansky.",,"Aristocracy Social class Drama, Love Drama, Bachelors Drama, Tabloid newspapers Drama, Man woman relationships Drama, Feature films, Fiction films, Fantasy films, Video recordings for the hearing impaired, Comedy films","Universal Studios Home Entertainment,","[2008]"
"Physical","Horizon","VIDEODISC","2008","10","150","The departed [videorecording] / Warner Bros. Pictures ; Vertigo Entertainment ; Initial Entertainment Group ; Plan B Entertainment ; Media Asia Films ; produced by Brad Grey, Graham King, Brad Pitt, Martin Scorsese ; screenplay by William Monahan ; directed by Martin Scorsese.",,"Organized crime Massachusetts Boston Drama, Organized crime investigation Massachusetts Boston Drama, Police Massachusetts Boston Drama, Undercover operations Massachusetts Boston Drama, Infiltration Military science Drama, Moles Spies Drama, South Boston Boston Mass Drama, Feature films, Thrillers Motion pictures, Fiction films, Gangster films, Video recordings for the hearing impaired","Warner Home Video,","[2007]"
"Physical","Horizon","VIDEODISC","2008","10","150","Mr. Bean's holiday [videorecording] / Universal Pictures ; Working Title ; Studio Canal in association with Motion Picture Alpha Produktionsgesellschaft, Tiger Aspect Pictures ; produced by Peter Bennett-Jones, Tim Bevan, Eric Fellner ; story by Simon McBurney ; screenplay by Hamish McColl and Robin Driscoll ; directed by Steve Bendelack.",,"Bean Mr Fictitious character Drama, Raffles England Drama, Vacations Drama, Cannes Film Festival Drama, France Drama, Feature films, Video recordings for the hearing impaired, Comedy films, Action and adventure films","Universal Studios Home Entertainment,","c2007."
"Physical","Horizon","VIDEODISC","2008","11","150","Balls of fury",,"Comedy films, Video recordings for the hearing impaired, Murder Investigation Drama, Feature films, Sports tournaments Drama, Table tennis Drama, Table tennis players Drama",,
"Physical","Horizon","VIDEODISC","2008","11","150","The holiday [videorecording] / Columbia Pictures Corporation ; Relativity Media ; Universal Pictures ; Waverly Films ; produced by Bruce A. Block, Nancy Meyers ; written by Nancy Meyers ; directed by Nancy Meyers.",,"Home exchanging Drama, Los Angeles Calif Drama, Surrey England Drama, Women Sexual behavior Drama, Man woman relationships Drama, Feature films, Romantic comedy films, Video recordings for the hearing impaired","Sony Pictures Home Entertainment,","[2007]"
"Physical","Horizon","VIDEODISC","2008","12","150","The departed [videorecording] / Warner Bros. Pictures ; Vertigo Entertainment ; Initial Entertainment Group ; Plan B Entertainment ; Media Asia Films ; produced by Brad Grey, Graham King, Brad Pitt, Martin Scorsese ; screenplay by William Monahan ; directed by Martin Scorsese.",,"Organized crime Massachusetts Boston Drama, Organized crime investigation Massachusetts Boston Drama, Police Massachusetts Boston Drama, Undercover operations Massachusetts Boston Drama, Infiltration Military science Drama, Moles Spies Drama, South Boston Boston Mass Drama, Feature films, Thrillers Motion pictures, Fiction films, Gangster films, Video recordings for the hearing impaired","Warner Home Video,","[2007]"
