"usageclass","checkouttype","materialtype","checkoutyear","checkoutmonth","checkouts","title","creator","subjects","publisher","publicationyear"
"Physical","Horizon","VIDEODISC","2011","5","150","Valkyrie [videorecording] = Walküre / Metro-Goldwyn-Mayer ; United Artists ; a Bad Hat Harry production ; an Achte Babelsberg film co-production ; directed by Bryan Singer ; written by Christopher McQuarrie & Nathan Alexander ; produced by Bryan Singer, Christopher McQuarrie, Gilbert Adler.",,"Operation Valkyrie 1944 Drama, Hitler Adolf 1889 1945 Assassination attempt 1944 July 20 Drama, Schenk von Stauffenberg Klaus Philipp Graf 1907 1944 Drama, Fiction films, Feature films, Thrillers Motion pictures, War films, Video recordings for the hearing impaired, Historical films","Metro Goldwyn Mayer Home Entertainment : Twentieth Century Fox Home Entertainment [distributor],","[2009]"
"Physical","Horizon","VIDEODISC","2011","5","150","The duchess [videorecording] / Paramount Vantage ; Pathé ; BBC Films ; in association with Pathé Renn Production and BIM Distribuzione ; a Qwerty Films/Magnolia Mae Films production ; produced by Michael Kuhn, Gabrielle Tana ; screenplay by Jeffrey Hatcher and Anders Thomas Jensen and Saul Dibb ; directed by Saul Dibb.",,"Devonshire Georgiana Spencer Cavendish Duchess of 1757 1806 Drama, Married women England Drama, Adultery England Drama, Triangles Interpersonal relations Drama, Scandals Drama, Biographical films, Historical films, Video recordings for the hearing impaired, Feature films","Paramount Home Entertainment,","2008."
"Physical","Horizon","VIDEODISC","2011","5","150","True blood. The complete first season [videorecording] / Home Box Office ; produced by Alexander Woo, Carol Dunn Trussell.",,"Stackhouse Sookie Fictitious character Drama, Vampires Drama, Waitresses Drama, Bars Drinking establishments Drama, Louisiana Drama, Fantasy television programs, Horror television programs, Video recordings for the hearing impaired, Television series, Fiction television programs","Home Box Office ; Distributed by Warner Home Video,","c2009."
"Physical","Horizon","VIDEODISC","2011","6","150","W. [videorecording] / Lionsgate, Omilab Media, QED International and Block/Hanson in association with Emperor Motion Pictures, Millbrook Pictures and Global Entertainment Group ; a Moritz Borman/Ixtlan production ; produced by Bill Block, Moritz Borman, Paul Hanson, Eric Kopeloff ; written by Stanley Weiser ; directed by Oliver Stone.",,"Bush George W George Walker 1946 Drama, Bush Laura Welch 1946 Drama, Presidents United States Election 2000 Drama, Presidents United States Election 2004 Drama, Iraq War 2003 2011 Drama, Historical films, Biographical films, Video recordings for the hearing impaired, Feature films, Fiction films","Lionsgate,","[2009]"
"Physical","Horizon","VIDEODISC","2011","7","150","Mad men. Season one [videorecording] / AMC ; Lions Gate Television Inc. ; Weiner Brothers.",,"Advertising agencies Drama, Man woman relationships New York State New York Drama, Advertising Drama, Businessmen Drama, Nineteen sixties Drama, Madison Avenue New York N Y Drama, Television series, Fiction television programs, Video recordings for the hearing impaired","Lionsgate,","[2008]"
"Physical","Horizon","VIDEODISC","2011","7","150","Frost/Nixon [videorecording] / Universal Pictures ; Imagine Entertainment ; Working Title Films ; in association with StudioCanal ; produced by Brian Grazer, Ron Howard, Tim Bevan, Eric Fellner ; screenplay by Peter Morgan ; directed by Ron Howard.",,"Nixon Richard M Richard Milhous 1913 1994 Drama, Frost David 1939 April 7 Drama, Watergate Affair 1972 1974 Drama, Presidents Interviews Drama, Abuse of administrative power Drama, Biographical films, Historical films, Video recordings for the hearing impaired, Feature films","Universal Studios Home Entertainment,","[2009]"
"Physical","Horizon","VIDEODISC","2011","8","150","The kite runner [videorecording] / DreamWorks Pictures ; Paramount Classics ; Participant Productions ; a Sidney Kimmel Entertainment and Parkes/MacDonald production ; produced by William Horberg, Walter Parkes, Rebecca Yeldham and E. Bennett Walsh ; screenplay by David Benioff ; directed by Marc Forster.",,"Kabul Afghanistan Drama, Male friendship Drama, Social classes Drama, Afghanistan Drama, Betrayal Drama, Boys Drama, Thrillers Motion pictures, Video recordings for the hearing impaired, Feature films","Paramount Home Entertainment,","[2008]"
"Physical","Horizon","VIDEODISC","2011","8","150","Away we go [videorecording] / Focus Features ; Big Beach ; produced by Edward Saxon, Marc Turtletaub, Peter Saraf ; written by Dave Eggers & Vendela Vega ; directed by Sam Mendes.",,"Couples Drama, Pregnant women Drama, Parenting Drama, Married people Drama, Friendship Drama, Families Drama, Comedy films, Feature films, Fiction films, Video recordings for the hearing impaired","Universal Studios Home Entertainment,","c2009."
"Physical","Horizon","VIDEODISC","2011","9","150","Burn after reading [videorecording] / Focus Features ; Working Title ; in association with StudioCanal and Relativity Media ; produced, written and directed by Joel Coen and Ethan Coen.",,"United States Central Intelligence Agency Drama, Adultery Drama, Extortion Drama, Fiction films, Gangster films, Video recordings for the hearing impaired, Feature films, Comedy films","Universal Studios Home Entertainment,","c2008."
"Physical","Horizon","VIDEODISC","2011","9","150","Duplicity [videorecording] / Universal Pictures, Relativity Media ; produced by Jennifer Fox, Kerry Orent, Laura Bickford ; written and directed by Tony Gilroy.",,"Agents provocateurs Drama, New products Drama, Competition Drama, Patents Drama, Man woman relationships Drama, Spy films, Action and adventure films, Video recordings for the hearing impaired, Feature films, Fiction films","Universal Studios Home Entertainment,","[2009]"
"Physical","Horizon","VIDEODISC","2011","12","150","Crazy heart [videorecording] / Fox Searchlight Pictures ; an Informant Media/Butchers Run Films production ; produced by Robert Duvall, Rob Carliner, Judy Cairo, T Bone Burnett ; written for the screen, produced and directed by Scott Cooper.",,"Country musicians Drama, Man woman relationships Drama, Alcoholics Drama, Feature films, Fiction films, Musical films, Video recordings for the hearing impaired","20th Century Fox Home Entertainment,","c2010."
"Physical","Horizon","VIDEODISC","2012","1","150","Cedar Rapids [videorecording] / Fox Searchlight Pictures ; an Ad Hominem Enterprises production ; produced by Jim Burke, Alexander Payne, Jim Taylor ; written by Phil Johnston ; directed by Miguel Arteta.",,"Insurance agents Drama, Cedar Rapids Iowa Drama, City and town life Drama, Feature films, Fiction films, Video recordings for the hearing impaired, Comedy films","20th Century Fox Home Entertainment,","2011."
"Physical","Horizon","VIDEODISC","2012","1","150","It's complicated [videorecording] / Universal Pictures in association with Relativity Media ; a Waverly Films/Scott Rudin production ; produced by Nancy Meyers, Scott Rudin ; written and directed by Nancy Meyers.",,"Divorced women Drama, Bakeries California Santa Barbara Drama, Architects Drama, Man woman relationships California Drama, Romantic comedy films, Video recordings for the hearing impaired, Video recordings for people with visual disabilities, Feature films, Fiction films","Universal Studios Home Entertainment,","c2010."
"Physical","Horizon","BOOK","2012","1","150","The sense of an ending / Julian Barnes.","Barnes, Julian","Middle aged men Fiction, Life change events Fiction, Male friendship Fiction, Psychological fiction","Alfred A. Knopf,","c2011."
"Physical","Horizon","VIDEODISC","2012","2","150","Fright night [videorecording] / Touchstone Pictures ; DreamWorks Pictures and Reliance Entertainment ; a Michael DeLuca and Gaeta/Rosenzsweig production ; produced by Michael DeLuca, Alison Rosenzweig ; screenplay by Marti Noxon ; directed by Craig Gillespie.",,"Vampires Drama, High school students Drama, Feature films, Vampire films, Horror films, Fiction films, Video recordings for the hearing impaired, Video recordings for people with visual disabilities","Distributed by Buena Vista Home Entertainment,","c2011."
"Physical","Horizon","VIDEODISC","2012","3","150","Get low [videorecording] / Sony Pictures Classics ; K5 International ; a Zanuck Independent Production in co-production with David Gundlach Productions, Lara Enterprises, TVN ; in association with Butchers Run Films ; directed by Aaron Schneider ; screenplay by Chris Provenzano and C. Gaby Mitchell ; story by Chris Provenzano and Scott Seeke ; produced by Dean Zanuck, David Gundlach.",,"Hermits Drama, Funeral rites and ceremonies Drama, Feature films, Fiction films, Comedy films, Video recordings for the hearing impaired","Sony Pictures Home Entertainment,","[2011]"
"Physical","Horizon","VIDEODISC","2012","3","150","X-men. First class [videorecording] / Twentieth Century Fox ; in association with Marvel Entertainment and Dune Entertainment ; a Bad Hat Harry, Donners' Company production ; produced by Lauren Shuler Donner, Bryan Singer, Simon Kinberg, Gregory Goodman ; story by Sheldon Turner and Bryan Singer ; screenplay by Ashley Edward Miller & Zack Stentz and Jane Goldman & Matthew Vaughn ; directed by Matthew Vaughn.",,"X Men Fictitious characters Drama, Mutation Biology Drama, Nuclear warfare Drama, Cuban Missile Crisis 1962 Drama, Feature films, Superhero films, Action and adventure films, Science fiction films, Fiction films, Video recordings for the hearing impaired, Video recordings for people with visual disabilities","Twentieth Century Fox Home Entertainment,","[2011]"
"Physical","Horizon","VIDEODISC","2012","3","150","Cave of forgotten dreams [videorecording] / Sundance Selects, Creative Differences and History Films present ; written, directed and narrated by Werner Herzog ; produced by Erik Nelson and Adrienne Ciuffo.",,"Chauvet Cave France, Cave paintings France Vallon Pont dArc, Art Prehistoric France Vallon Pont dArc, Video recordings for the hearing impaired, Documentary films, Nonfiction films","Sundance Selects : MPI Media Group,","c2011."
"Physical","Horizon","VIDEODISC","2012","3","150","Flickan som lekte med elden [videorecording] = Stieg Larsson's The girl who played with fire / Yellow Bird ; i samproduktion med ZDF Enterprises, Sveriges Television, Nordisk Film, ZDF och Filmpool Stockholm Mälardalen, Film i Väst, Spiltan Underhällning M AB med stod fran Svenska Filminstitutet ; manus, Jonas Frykberg ; producent, Søren Stærmose ; en film av Daniel Alfredson.",,"Salander Lisbeth Fictitious character Drama, Prostitution Drama, Journalists Drama, Murder Drama, Sweden Drama, Feature films, Fiction films, Detective and mystery films","Music Box Films,","[2010]"
"Physical","Horizon","VIDEODISC","2012","6","150","A serious man [videorecording] / Focus Features ; Working Title ; in association with Studiocanal and Relativity Media ; written, produced and directed by Joel Coen & Ethan Coen.",,"Middle aged men Drama, Man woman relationships Drama, Feature films, Fiction films, Comedy films, Video recordings for the hearing impaired","Universal,","[2010]"
"Physical","Horizon","VIDEODISC","2012","6","150","Portlandia Season one [videorecording] / IFC Originals ; Broadway Video.",,"Portland Or Drama, Popular culture United States Humor Drama, Sketch comedy television programs, Television series, Fiction television programs","Video Services Corp.,","2011."
"Physical","Horizon","VIDEODISC","2012","7","150","The Lincoln lawyer [videorecording] / a Lakeshore Entertainment/Lionsgate production in association with Sidney Kimmel Entertainment ; Stone Village Pictures ; producers, Sidney Kimmel ... [and others] ; screenplay by John Romano ; directed by Brad Furman.",,"Haller Mickey Fictitious character Drama, Defense Criminal procedure Drama, Trials Murder Drama, Feature films, Fiction films, Thrillers Motion pictures, Legal films, Video recordings for the hearing impaired","Lions Gate Home Entertainment,","[2011]"
"Physical","Horizon","BOOK","2012","8","150","Mockingjay / Suzanne Collins.","Collins, Suzanne","Insurgency Juvenile fiction, Survival Juvenile fiction, Wilderness survival Juvenile fiction, Television programs Juvenile fiction, Interpersonal relations Juvenile fiction, Contests Juvenile fiction, Science fiction Juvenile fiction","Scholastic Press,","2010."
"Physical","Horizon","VIDEODISC","2012","9","150","The social network [videorecording] / Columbia ; in association with Relativity Media ; a Scott Rudin/Michael De Luca/Trigger Street production ; screenplay by Aaron Sorkin ; produced by Scott Rudin, Dana Brunetti, Michael de Luca, Ceán Chaffin ; directed by David Fincher.",,"Zuckerberg Mark 1984 Drama, Facebook Firm Drama, College students Drama, Social networks Drama, Feature films, Autobiographical fiction, Video recordings for the hearing impaired, Video recordings for people with visual disabilities","Sony Pictures Home Entertainment,","[2011]"
"Digital","OverDrive","EBOOK","2012","9","150","Gone Girl: A Novel","Gillian Flynn","Fiction, Mystery, Suspense, Thriller","Random House, Inc.","2012"
"Physical","Horizon","VIDEODISC","2012","9","150","Safe house [videorecording] / Universal ; Relativity Media ; a Bluegrass Films production ; produced by Scott Stuber ; written by David Guggenheim ; directed by Daniel Espinosa.",,"United States Central Intelligence Agency Drama, Traitors Drama, Feature films, Action and adventure films, Video recordings for the hearing impaired, Video recordings for people with visual disabilities, Fiction films","Universal Studios Home Entertainment,","[2012]"
"Physical","Horizon","BOOK","2012","9","150","Mockingjay / Suzanne Collins.","Collins, Suzanne","Insurgency Juvenile fiction, Survival Juvenile fiction, Wilderness survival Juvenile fiction, Television programs Juvenile fiction, Interpersonal relations Juvenile fiction, Contests Juvenile fiction, Science fiction Juvenile fiction","Scholastic Press,","2010."
"Physical","Horizon","VIDEODISC","2012","11","150","Take this waltz [videorecording] / Magnolia Pictures ; Joe's Daughter, & Mongrel Media ; in association with TF1 Droits Audiovisuels ; with the participation of Telefilm Canada, Ontario Media Development Corporation and Astral's The Harold Greenberg Fund ; produced by Susan Cavan and Sarah Polley ; directed and written by Sarah Polley.",,"Authors Drama, Artists Drama, Man woman relationships Drama, Neighbors Drama, Fiction films, Feature films, Video recordings for the hearing impaired","Magnolia Home Entertainment,","2012."
"Physical","Horizon","VIDEODISC","2012","11","150","Breaking bad. The complete fourth season [videorecording] / Sony Pictures Television.",,"Chemistry teachers Drama, Drug traffic Drama, Methamphetamine Economic aspects Drama, Drug dealers Drama, Terminally ill Drama, Ice Drug Drama, Fiction television programs, Television series, Video recordings for the hearing impaired","Sony Pictures Home Entertainment,","[2012]"
"Physical","Horizon","VIDEODISC","2012","12","150","Boardwalk empire. The complete second season [videorecording] / HBO Entertainment.",,"Gangsters New Jersey Drama, Racketeering Drama, Criminals New Jersey Atlantic City Drama, Television series, Historical television programs, Fiction television programs, Video recordings for the hearing impaired","Home Box Office ; distributed by Warner Home Video,","c2012."
"Physical","Horizon","VIDEODISC","2013","1","150","The woman in black [videorecording] / CBS Films and Cross Creek Pictures ; in association with Hammer and Alliance Films ; a Talisman production in association with Exclusive Media Group and the UK Film Council ; directed by James Watkins ; screenplay, Jane Goldman ; produced by Richard Jackson, Simon Oakes, Brian Oliver.",,"Ghost plays, Haunted houses Drama, Horror films, Fiction films, Feature films, Video recordings for the hearing impaired","Sony Pictures Home Entertainment,","c2012."
"Physical","Horizon","VIDEODISC","2013","3","150","Safe [videorecording] / Lionsgate ; IM Global ; produced by Lawrence Bender, Dana Brunetti ; written and directed by Boaz Yakin.",,"Gangsters Drama, Ciphers Drama, Action and adventure films, Feature films, Fiction films, Video recordings for the hearing impaired","Lions Gate Entertainment,","[2012]"
"Physical","Horizon","BOOK","2013","6","150","Beautiful ruins : a novel / Jess Walter.","Walter, Jess, 1965-","Hotelkeepers Italy Fiction, Motion picture actors and actresses Fiction, Americans Italy Fiction, Man woman relationships Fiction","Harper,","c2012."
"Physical","Horizon","VIDEODISC","2013","6","150","The dictator [videorecording] / Paramount Pictures ; Four By Two Films ; produced by Sacha Baron Cohen ... [and others] ; written by Sacha Baron Cohen & Alec Berg & David Mandel & Jeff Schaffer ; directed by Larry Charles.",,"Dictators Drama, Exiles Drama, American Dream Drama, Feature films, Fiction films, Video recordings for people with visual disabilities, Video recordings for the hearing impaired, Comedy films","Paramount Pictures,","2012."
"Physical","Horizon","VIDEODISC","2013","7","150","The descendants [videorecording] / Fox Searchlight Pictures ; an Ad Hominem Enterprises production ; made in association with Dune Entertainment and produced in association with Little Blair Productions and Ingeneous Film Partners ; directed by Alexander Payne ; screenplay by Alexander Payne and Nat Faxon & Jim Rash ; produced by Jim Burke, Alexander Payne, Jim Taylor.",,"Fathers and daughters Drama, Husband and wife Drama, Parent and child Drama, Mothers Death Drama, Families Drama, Boating accidents Drama, Families of royal descent Hawaii Drama, Hawaii Drama, Fiction films, Feature films, Video recordings for the hearing impaired, Video recordings for people with visual disabilities","20th Century Fox Home Entertainment,","2012."
"Physical","Horizon","SOUNDDISC","2013","8","150","Random access memories [sound recording] / Daft Punk.","Daft Punk (Musical group)","Popular music 2011 2020, Underground dance music","Columbia ,","p2013."
"Physical","Horizon","VIDEODISC","2013","8","150","Gangster squad [videorecording] / Warner Bros. Pictures ; in association with Village Roadshow Pictures ; written by Will Beall ; produced by Dan Lin, Kevin McCormick, Michael Tadross ; directed by Reuben Fleischer.",,"Gangsters California Los Angeles Drama, Police California Los Angeles Drama, Feature films, Fiction films, Gangster films, Historical films, Video recordings for the hearing impaired","Warner Home Video,","[2013]"
"Physical","Horizon","VIDEODISC","2013","9","150","Cosmopolis [videorecording] / Entertainment One ; an Alfama Films/Prospero Pictures production ; in coproduction with Kinologic Films (DC) and France 2 Cinema ; produced with the participation of Telefilm Canada ; in association with Talandracas Pictures ; with the participation of France Televisions, Canal+, Rai Cinema, RTP ; produced with the participation of Ontario Media Development Corporation, Astral Media, the Harold Greenburg Fund ; directed by David Cronenberg ; produced by Martin Katz, Paulo Branco ; screenplay by David Cronenberg.",,"Billionaires Drama, Derivative securities Drama, Foreign exchange China Drama, Feature films, Fiction films, Video recordings for the hearing impaired","Entertainment One,","2012"
"Physical","Horizon","VIDEODISC","2013","10","150","Cosmopolis [videorecording] / Entertainment One ; an Alfama Films/Prospero Pictures production ; in coproduction with Kinologic Films (DC) and France 2 Cinema ; produced with the participation of Telefilm Canada ; in association with Talandracas Pictures ; with the participation of France Televisions, Canal+, Rai Cinema, RTP ; produced with the participation of Ontario Media Development Corporation, Astral Media, the Harold Greenburg Fund ; directed by David Cronenberg ; produced by Martin Katz, Paulo Branco ; screenplay by David Cronenberg.",,"Billionaires Drama, Derivative securities Drama, Foreign exchange China Drama, Feature films, Fiction films, Video recordings for the hearing impaired","Entertainment One,","2012"
"Physical","Horizon","VIDEODISC","2013","11","150","The bling ring [videorecording] / A24 ; Nala Films ; in association with Pathé Distribution, Tohokushinsha Film Corporation, Tobis Film GmbH & Co. KG, Studiocanal Limited, FilmNation ; an American Zoetrope production ; produced by Roman Coppola, Sofia Coppola, Youree Henley ; written and directed by Sofia Coppola.",,"Burglary Drama, Robbery Drama, Teenagers Drama, High school students Drama, Hollywood Los Angeles Calif Drama, Feature films, Fiction films, Video recordings for the hearing impaired","Lions Gate Home Entertainment,","2013."
"Physical","Horizon","VIDEODISC","2013","11","150","Behind the candelabra [videorecording] / HBO Films ; a Jerry Weintraub production ; directed by Steven Soderbergh ; produced by Gregory Jacobs, Susan Ekins, Michael Polaire ; screenplay by Richard LaGravenese.",,"Liberace 1919 1987 Drama, Pianists Drama, Gay musicians Drama, Gay couples Drama, Made for TV movies, Biographical television programs, Fiction television programs, Video recordings for the hearing impaired","Warner Home Entertainment,","2013."
"Physical","Horizon","VIDEODISC","2013","12","150","Seven psychopaths [videorecording] / CBS Films ; Film4 ; BFI ; a Blueprint Pictures production ; produced by Graham Broadbent, Pete Czernin, Martin McDonagh ; written and directed by Martin McDonagh.",,"Screenwriters Drama, Gangsters Drama, Shih tzu Drama, Kidnapping Drama, Los Angeles Calif Drama, Comedy films, Thrillers Motion pictures, Feature films, Video recordings for the hearing impaired, Fiction films","Sony Pictures Home Entertainment,","c2013."
"Physical","Horizon","BOOK","2013","12","150","W is for wasted / Sue Grafton.","Grafton, Sue","Millhone Kinsey Fictitious character Fiction, Women private investigators Fiction, Mystery fiction","G.P. Putnam's Sons,","2013."
"Physical","Horizon","VIDEODISC","2014","2","150","Before midnight [videorecording] / Sony Pictures Classics ; Faliro House ; in association with Venture Forth and Castle Rock Entertainment ; a Detour filmproduction ; directed by Richard Linklater ; producers, Christos Konstantakopoulos, Richard Linklater, Sara Woodhatch ; written by Richard Linklater, Julie Delpy, Ethan Hawke.",,"Man woman relationships Drama, Greece Drama, Feature films, Fiction films, Video recordings for the hearing impaired","Sony Pictures Home Entertainment,","2013."
"Physical","Horizon","VIDEODISC","2014","3","150","Homeland. The complete first season [videorecording] / Fox 21.",,"Prisoners of war Drama, Qaida Organization Drama, Terrorists Drama, United States Central Intelligence Agency Drama, Television series, Spy television programs, Detective and mystery television programs, Thrillers Television programs, Fiction television programs, Video recordings for the hearing impaired","20th Century Fox Home Entertainment,","2012."
"Physical","Horizon","VIDEODISC","2014","3","150","Oldboy [videorecording] / Filmdistrict ; Good Universe ; a Vertigo Entertainment/40 Acres and a Mule production ; produced by Roy Lee, Doug Davison, Nathan Kahane ; screenplay by Mark Protosevich ; directed by Spike Lee.",,"Kidnapping Drama, Hostages Drama, Conspiracies Drama, Feature films, Action and adventure films, Thrillers Motion pictures, Fiction films, Video recordings for the hearing impaired","Sony Pictures Home Entertainment,","[2014]"
"Physical","Horizon","VIDEODISC","2014","4","150","Identity thief [videorecording] / Universal Pictures in association with Relativity Media ; a Bluegrass Films, Aggregate Films production ; produced by Scott Stuber, Jason Bateman, Pamela Abdy ; story by Jerry Eeten, Craig Mazin ; screenplay by Craig Mazin ; directed by Seth Gordon.",,"Identity theft Drama, Businessmen Drama, Feature films, Comedy films, Fiction films, Video recordings for the hearing impaired, Video recordings for people with visual disabilities","Universal Studios Home Entertainment,","c2013."
"Physical","Horizon","VIDEODISC","2014","5","150","Lincoln [videorecording] / Touchstone Pictures ; DreamWorks Pictures, Twentieth Century Fox and Reliance Entertainment ; in association with Participant Media and Dune Entertainment ; an Amblin Entertainment, Kennedy/Marshall Company production ; produced by Steven Spielberg, Kathleen Kennedy ; screenplay by Tony Kushner ; director, Steven Spielberg.",,"Lincoln Abraham 1809 1865 Drama, United States History Civil War 1861 1865 Drama, Feature films, Biographical films, Historical films, Fiction films, Video recordings for the hearing impaired, Video recordings for people with visual disabilities","DreamWorks Pictures,","c2013"
"Physical","Horizon","VIDEODISC","2014","5","150","The East [videorecording] / Fox Searchlight Pictures ; a Scott Free production ; written by Zal Batmanglij & Brit Marling ; produced by Ridley Scott, Michael Costigan, Jocelyn Hayes-Simpson, Brit Marling ; directed by Zal Batmanglij.",,"Undercover operations Drama, Humanity Crimes against Drama, Human rights workers Drama, Feature films, Fiction films, Thrillers Motion pictures, Video recordings for the hearing impaired, Video recordings for people with visual disabilities","20th Century Fox Home Entertainment,","[2013]"
"Physical","Horizon","BOOK","2014","8","150","All the light we cannot see : a novel / Anthony Doerr.","Doerr, Anthony, 1973-","Blind Fiction, World War 1939 1945 Youth France Fiction, World War 1939 1945 Youth Germany Fiction, France History German occupation 1940 1945 Fiction, Saint Malo France Fiction, Historical fiction","Scribner,","2014."
